{
  "schema": "aleph.external_training.experiment_record.v1",
  "authority_status": "proposed",
  "review_state": "double_adjudication_pending",
  "experiment_record_id": "aleph:experiment:0123456789abcdef",
  "source": {
    "source_family_id": "doi:10.0000/example",
    "pmcid": "PMC123456",
    "acquisition_pass": "first",
    "publication_year": 2024,
    "primary_domain": "cortical_membrane_pressure"
  },
  "biological_systems": [{
    "biological_system_id": "bio:1",
    "organism": {"label": "human", "identifier": "NCBITaxon:9606", "normalization_status": "exact", "candidates": []},
    "tissue": {"label": null, "identifier": null, "normalization_status": "missing", "candidates": []},
    "cell_type": {"label": "epithelial cell", "identifier": null, "normalization_status": "candidate", "candidates": []},
    "cell_line": {"label": null, "identifier": null, "normalization_status": "missing", "candidates": []},
    "cell_states": [],
    "genotype": null,
    "donor_attributes": {"sex": null, "age": null, "disease": null, "passage": null}
  }],
  "conditions": [{
    "condition_id": "cond:control",
    "biological_system_id": "bio:1",
    "role": "control",
    "factors": [],
    "environment": {"media": null, "temperature": null, "substrate": null, "geometry": null}
  }],
  "protocols": [{
    "protocol_id": "protocol:1",
    "modality": "micropipette_aspiration",
    "instrument": null,
    "calibration": null,
    "analysis_pipeline": null,
    "evidence": [{
      "document_sha256": "aaaaaaaaaaaaaaaaaaaaaaaaaaaaaaaaaaaaaaaaaaaaaaaaaaaaaaaaaaaaaaaa",
      "section_path": ["Methods"],
      "locator_type": "paragraph",
      "locator_id": "p1",
      "text_or_asset_sha256": "bbbbbbbbbbbbbbbbbbbbbbbbbbbbbbbbbbbbbbbbbbbbbbbbbbbbbbbbbbbbbbbb",
      "char_start": 0,
      "char_end": 40
    }]
  }],
  "observations": [{
    "observation_id": "aleph:observation:0123456789abcdef",
    "observation_type": "scalar",
    "protocol_id": "protocol:1",
    "condition_ids": ["cond:control"],
    "measured_entity": "cortical_tension",
    "value_state": "reported",
    "value": 0.5,
    "unit": {"reported": "nN/um", "normalized": "pN/um", "normalization_status": "converted", "conversion_formula": "x * 1000", "conversion_evidence": [{"document_sha256": "aaaaaaaaaaaaaaaaaaaaaaaaaaaaaaaaaaaaaaaaaaaaaaaaaaaaaaaaaaaaaaaa", "section_path": ["Methods"], "locator_type": "paragraph", "locator_id": "p1", "text_or_asset_sha256": "bbbbbbbbbbbbbbbbbbbbbbbbbbbbbbbbbbbbbbbbbbbbbbbbbbbbbbbbbbbbbbbb", "char_start": 0, "char_end": 40}]},
    "uncertainty": [{"type": "sd", "lower": null, "upper": null, "value": 0.1, "unit": "nN/um", "level": null}],
    "replicates": {"biological_n": 3, "technical_n": null, "unit_of_replication": "culture", "aggregation": "mean", "independence_status": "reported"},
    "visual_payload": null,
    "evidence": [{"document_sha256": "aaaaaaaaaaaaaaaaaaaaaaaaaaaaaaaaaaaaaaaaaaaaaaaaaaaaaaaaaaaaaaaa", "section_path": ["Results"], "locator_type": "table_cell", "locator_id": "table1:r2:c3", "text_or_asset_sha256": "cccccccccccccccccccccccccccccccccccccccccccccccccccccccccccccccc", "char_start": null, "char_end": null}],
    "extraction": {"status": "double_annotated", "confidence": null, "method": "independent_manual_annotation", "ambiguity_reason": null, "candidates": []}
  }],
  "comparisons": [],
  "provenance": {
    "source_receipt_sha256": "dddddddddddddddddddddddddddddddddddddddddddddddddddddddddddddddd",
    "candidate_record_sha256": "eeeeeeeeeeeeeeeeeeeeeeeeeeeeeeeeeeeeeeeeeeeeeeeeeeeeeeeeeeeeeeee",
    "annotation_template_version": "1.0.0",
    "annotator_ids": ["annotator:a", "annotator:b"],
    "adjudicator_id": null,
    "created_at": "2026-08-05T00:00:00Z",
    "updated_at": "2026-08-05T00:00:00Z",
    "record_sha256": null
  }
}
